"No.","Time","Source","Destination","Protocol","Length","Info"
"1","0.000000000","192.168.1.43","69.173.158.64","TCP","66","46710  >  443 [ACK] Seq=1 Ack=1 Win=501 Len=0 TSval=3439940803 TSecr=527111886"
"2","0.135114468","69.173.158.64","192.168.1.43","TCP","66","[TCP ACKed unseen segment] 443  >  46710 [ACK] Seq=1 Ack=2 Win=51183 Len=0 TSval=527114715 TSecr=3439929646"
"3","0.577704958","107.151.11.18","192.168.1.43","TLSv1.2","90","Application Data"
"4","0.577862499","192.168.1.43","107.151.11.18","TCP","66","47774  >  443 [ACK] Seq=1 Ack=25 Win=501 Len=0 TSval=3470154684 TSecr=3772555232"
"5","0.577705698","107.151.11.18","192.168.1.43","TCP","66","443  >  47774 [FIN, ACK] Seq=25 Ack=1 Win=83 Len=0 TSval=3772555232 TSecr=3470139701"
"6","0.580516329","192.168.1.43","107.151.11.18","TLSv1.2","90","Application Data"
"7","0.842303134","107.151.11.18","192.168.1.43","TCP","60","443  >  47774 [RST] Seq=26 Win=0 Len=0"
"8","1.279491763","192.168.1.43","35.213.12.39","TCP","66","54152  >  443 [ACK] Seq=1 Ack=1 Win=501 Len=0 TSval=3971014773 TSecr=2294945839"
"9","1.430167241","192.168.1.43","172.217.19.238","QUIC","1399","0-RTT, DCID=2c1e4c26f8a514e3b2d276712a6cf4, SCID=7e5f57"
"10","1.431401079","192.168.1.43","172.217.19.238","QUIC","1399","0-RTT, DCID=2c1e4c26f8a514e3b2d276712a6cf4, SCID=7e5f57"
"11","1.441401134","192.168.1.43","172.217.19.238","QUIC","768","0-RTT, DCID=2c1e4c26f8a514e3b2d276712a6cf4, SCID=7e5f57"
"12","1.458974045","142.250.181.74","192.168.1.43","TLSv1.2","151","Application Data"
"13","1.458974577","142.250.181.74","192.168.1.43","TLSv1.2","97","Application Data"
"14","1.459634115","192.168.1.43","142.250.181.74","TCP","66","40540  >  443 [ACK] Seq=1 Ack=117 Win=501 Len=0 TSval=1803001163 TSecr=2027597394"
"15","1.463944886","142.250.181.74","192.168.1.43","TLSv1.2","105","Application Data"
"16","1.464376925","192.168.1.43","142.250.181.74","TLSv1.2","105","Application Data"
"17","1.497688356","192.168.1.43","142.250.181.74","TLSv1.2","301","Application Data"
"18","1.500549862","172.217.19.238","192.168.1.43","QUIC","1399","Initial, DCID=7e5f57, SCID=ec1e4c26f8a514e3, PKN: 1, ACK, PADDING"
"19","1.510069356","142.250.181.74","192.168.1.43","TCP","66","443  >  40540 [ACK] Seq=156 Ack=40 Win=489 Len=0 TSval=2027597465 TSecr=1803001168"
"20","1.564581018","142.250.181.74","192.168.1.43","TCP","66","443  >  40540 [ACK] Seq=156 Ack=275 Win=489 Len=0 TSval=2027597500 TSecr=1803001201"
"21","1.564581939","35.213.12.39","192.168.1.43","TCP","66","[TCP ACKed unseen segment] 443  >  54152 [ACK] Seq=1 Ack=2 Win=501 Len=0 TSval=2294956332 TSecr=3970973144"
"22","1.593445063","172.217.19.238","192.168.1.43","QUIC","1399","Handshake, DCID=7e5f57, SCID=ec1e4c26f8a514e3"
"23","1.593445505","172.217.19.238","192.168.1.43","QUIC","657","Protected Payload (KP0), DCID=7e5f57"
"24","1.593445779","172.217.19.238","192.168.1.43","QUIC","69","Protected Payload (KP0), DCID=7e5f57"
"25","1.593445878","172.217.19.238","192.168.1.43","QUIC","67","Protected Payload (KP0), DCID=7e5f57"
"26","1.606138008","192.168.1.43","172.217.19.238","QUIC","271","Handshake, DCID=ec1e4c26f8a514e3, SCID=7e5f57"
"27","1.664473315","172.217.19.238","192.168.1.43","QUIC","165","Protected Payload (KP0), DCID=7e5f57"
"28","1.695625659","192.168.1.43","172.217.19.238","QUIC","74","Protected Payload (KP0), DCID=ec1e4c26f8a514e3"
"29","1.785036420","142.250.181.74","192.168.1.43","TLSv1.2","135","Application Data"
"30","1.790353016","142.250.181.74","192.168.1.43","TLSv1.2","97","Application Data"
"31","1.790353514","142.250.181.74","192.168.1.43","TLSv1.2","105","Application Data"
"32","1.792744620","192.168.1.43","142.250.181.74","TCP","66","40540  >  443 [ACK] Seq=275 Ack=295 Win=501 Len=0 TSval=1803001496 TSecr=2027597713"
"33","1.793178550","192.168.1.43","142.250.181.74","TLSv1.2","105","Application Data"
"34","1.800177459","192.168.1.43","142.250.181.74","TLSv1.2","751","Application Data"
"35","1.874972738","142.250.181.74","192.168.1.43","TCP","66","443  >  40540 [ACK] Seq=295 Ack=314 Win=489 Len=0 TSval=2027597793 TSecr=1803001497"
"36","1.889558120","142.250.181.74","192.168.1.43","TCP","66","443  >  40540 [ACK] Seq=295 Ack=999 Win=489 Len=0 TSval=2027597802 TSecr=1803001504"
"37","1.931322650","172.217.19.238","192.168.1.43","QUIC","1395","Protected Payload (KP0), DCID=7e5f57"
"38","1.931323038","172.217.19.238","192.168.1.43","QUIC","74","Protected Payload (KP0), DCID=7e5f57"
"39","1.931323149","172.217.19.238","192.168.1.43","QUIC","277","Protected Payload (KP0), DCID=7e5f57"
"40","1.937935645","192.168.1.43","172.217.19.238","QUIC","79","Protected Payload (KP0), DCID=ec1e4c26f8a514e3"
"41","2.011559722","172.217.19.238","192.168.1.43","QUIC","69","Protected Payload (KP0), DCID=7e5f57"
"42","2.017185769","192.168.1.43","216.239.34.180","TLSv1.2","1998","Application Data"
"43","2.017805149","192.168.1.43","216.239.34.180","TLSv1.2","326","Application Data"
"44","2.058136699","142.250.181.74","192.168.1.43","TLSv1.2","133","Application Data"
"45","2.058137280","142.250.181.74","192.168.1.43","TLSv1.2","115","Application Data"
"46","2.060521293","192.168.1.43","142.250.181.74","TCP","66","40540  >  443 [ACK] Seq=999 Ack=411 Win=501 Len=0 TSval=1803001764 TSecr=2027598013"
"47","2.072586894","216.239.34.180","192.168.1.43","TCP","66","443  >  55408 [ACK] Seq=1 Ack=1401 Win=489 Len=0 TSval=1251860605 TSecr=2391815782"
"48","2.072588531","216.239.34.180","192.168.1.43","TCP","66","443  >  55408 [ACK] Seq=1 Ack=1933 Win=489 Len=0 TSval=1251860605 TSecr=2391815782"
"49","2.072588635","216.239.34.180","192.168.1.43","TCP","66","443  >  55408 [ACK] Seq=1 Ack=2193 Win=489 Len=0 TSval=1251860610 TSecr=2391815782"
"50","2.393283425","216.239.34.180","192.168.1.43","TLSv1.2","570","Application Data"
"51","2.393284316","216.239.34.180","192.168.1.43","TLSv1.2","97","Application Data"
"52","2.393284611","216.239.34.180","192.168.1.43","TLSv1.2","105","Application Data"
"53","2.414054712","192.168.1.43","216.239.34.180","TCP","66","55408  >  443 [ACK] Seq=2193 Ack=575 Win=501 Len=0 TSval=2391816178 TSecr=1251860885"
"54","2.416511340","192.168.1.43","216.239.34.180","TLSv1.2","105","Application Data"
"55","2.499419317","216.239.34.180","192.168.1.43","TCP","66","443  >  55408 [ACK] Seq=575 Ack=2232 Win=489 Len=0 TSval=1251861003 TSecr=2391816181"
"56","3.748516947","2.21.52.204","192.168.1.43","TLSv1.2","90","Application Data"
"57","3.749082034","192.168.1.43","2.21.52.204","TCP","66","39870  >  443 [ACK] Seq=1 Ack=25 Win=501 Len=0 TSval=4026092021 TSecr=3297911965"
"58","3.750009034","192.168.1.43","2.21.52.204","TLSv1.2","105","Application Data"
"59","3.754940688","192.168.1.43","2.21.52.204","TLSv1.2","90","Application Data"
"60","3.757165692","2.21.52.204","192.168.1.43","TCP","66","443  >  39870 [FIN, ACK] Seq=25 Ack=1 Win=503 Len=0 TSval=3297911965 TSecr=4026072106"
"61","3.757217708","192.168.1.43","2.21.52.204","TCP","66","39870  >  443 [ACK] Seq=65 Ack=26 Win=501 Len=0 TSval=4026092030 TSecr=3297911965"
"62","3.925780438","2.21.52.204","192.168.1.43","TCP","60","443  >  39870 [RST] Seq=25 Win=0 Len=0"
"63","3.932573280","2.21.52.204","192.168.1.43","TCP","60","443  >  39870 [RST] Seq=25 Win=0 Len=0"
"64","3.932574208","2.21.52.204","192.168.1.43","TCP","60","443  >  39870 [RST] Seq=26 Win=0 Len=0"
"65","4.475440061","192.168.1.28","192.168.1.43","TCP","74","35280  >  5672 [SYN] Seq=0 Win=64240 Len=0 MSS=1460 SACK_PERM TSval=3545328453 TSecr=0 WS=128"
"66","4.475475455","192.168.1.43","192.168.1.28","TCP","74","5672  >  35280 [SYN, ACK] Seq=0 Ack=1 Win=65160 Len=0 MSS=1460 SACK_PERM TSval=1852358360 TSecr=3545328453 WS=128"
"67","4.478460972","192.168.1.28","192.168.1.43","TCP","66","35280  >  5672 [ACK] Seq=1 Ack=1 Win=64256 Len=0 TSval=3545328456 TSecr=1852358360"
"68","4.483534744","192.168.1.28","192.168.1.43","AMQP","74","Protocol-Header 0-9-1"
"69","4.483563691","192.168.1.43","192.168.1.28","TCP","66","5672  >  35280 [ACK] Seq=1 Ack=9 Win=65152 Len=0 TSval=1852358368 TSecr=3545328461"
"70","4.545291207","192.168.1.43","192.168.1.28","AMQP","579","Connection.Start "
"71","4.546689544","192.168.1.28","192.168.1.43","TCP","66","35280  >  5672 [ACK] Seq=9 Ack=514 Win=64128 Len=0 TSval=3545328524 TSecr=1852358430"
"72","4.548618655","192.168.1.28","192.168.1.43","AMQP","369","Connection.Start-Ok "
"73","4.548649536","192.168.1.43","192.168.1.28","TCP","66","5672  >  35280 [ACK] Seq=514 Ack=312 Win=64896 Len=0 TSval=1852358433 TSecr=3545328527"
"74","4.558201168","192.168.1.43","192.168.1.28","AMQP","86","Connection.Tune "
"75","4.560293155","192.168.1.28","192.168.1.43","AMQP","86","Connection.Tune-Ok "
"76","4.560320229","192.168.1.43","192.168.1.28","TCP","66","5672  >  35280 [ACK] Seq=534 Ack=332 Win=64896 Len=0 TSval=1852358445 TSecr=3545328538"
"77","4.563791582","192.168.1.28","192.168.1.43","AMQP","89","Connection.Open vhost=my_vhost "
"78","4.563809946","192.168.1.43","192.168.1.28","TCP","66","5672  >  35280 [ACK] Seq=534 Ack=355 Win=64896 Len=0 TSval=1852358448 TSecr=3545328541"
"79","4.570007494","192.168.1.43","192.168.1.28","AMQP","79","Connection.Open-Ok "
"80","4.574815398","192.168.1.28","192.168.1.43","AMQP","79","Channel.Open "
"81","4.574844676","192.168.1.43","192.168.1.28","TCP","66","5672  >  35280 [ACK] Seq=547 Ack=368 Win=64896 Len=0 TSval=1852358459 TSecr=3545328552"
"82","4.588050033","192.168.1.43","192.168.1.28","AMQP","82","Channel.Open-Ok "
"83","4.591110265","192.168.1.28","192.168.1.43","AMQP","94","Queue.Declare q=my_queue "
"84","4.600121056","192.168.1.43","192.168.1.28","AMQP","95","Queue.Declare-Ok q=my_queue "
"85","4.601971381","192.168.1.28","192.168.1.43","AMQP","91","Basic.Publish x= rk=my_queue "
"86","4.602673449","192.168.1.28","192.168.1.43","AMQP","88","Content-Header "
"87","4.603326934","192.168.1.28","192.168.1.43","AMQP","145","Content-Body "
"88","4.603513554","192.168.1.43","192.168.1.28","TCP","66","5672  >  35280 [ACK] Seq=592 Ack=522 Win=64896 Len=0 TSval=1852358488 TSecr=3545328580"
"89","5.226190680","192.168.1.43","142.250.181.78","TLSv1.2","105","Application Data"
"90","5.228759588","192.168.1.43","142.250.181.78","TLSv1.2","90","Application Data"
"91","5.229771264","192.168.1.43","142.250.181.78","TCP","66","36108  >  443 [FIN, ACK] Seq=64 Ack=1 Win=501 Len=0 TSval=1290622323 TSecr=664694362"
"92","5.302004220","142.250.181.78","192.168.1.43","TCP","66","443  >  36108 [FIN, ACK] Seq=1 Ack=64 Win=489 Len=0 TSval=664746983 TSecr=1290622320"
"93","5.302040475","192.168.1.43","142.250.181.78","TCP","66","36108  >  443 [ACK] Seq=65 Ack=2 Win=501 Len=0 TSval=1290622395 TSecr=664746983"
"94","5.302004823","142.250.181.78","192.168.1.43","TCP","66","[TCP Keep-Alive] 443  >  36108 [ACK] Seq=1 Ack=64 Win=489 Len=0 TSval=664746983 TSecr=1290622320"
"95","5.302320079","192.168.1.43","142.250.181.78","TCP","66","[TCP Keep-Alive ACK] 36108  >  443 [ACK] Seq=65 Ack=2 Win=501 Len=0 TSval=1290622396 TSecr=664746983"
"96","5.302004928","142.250.181.78","192.168.1.43","TCP","66","443  >  36108 [ACK] Seq=2 Ack=65 Win=489 Len=0 TSval=664746983 TSecr=1290622323"
"97","5.445790643","192.168.1.43","192.168.1.1","DNS","75","Standard query 0x32af A play.google.com"
"98","5.500854728","192.168.1.1","192.168.1.43","DNS","91","Standard query response 0x32af A play.google.com A 172.217.19.238"
"99","5.501828623","192.168.1.43","172.217.19.238","TCP","74","54108  >  443 [SYN] Seq=0 Win=64240 Len=0 MSS=1460 SACK_PERM TSval=1337375108 TSecr=0 WS=128"
"100","5.559015058","172.217.19.238","192.168.1.43","TCP","74","443  >  54108 [SYN, ACK] Seq=0 Ack=1 Win=65535 Len=0 MSS=1412 SACK_PERM TSval=537649789 TSecr=1337375108 WS=256"
"101","5.559114118","192.168.1.43","172.217.19.238","TCP","66","54108  >  443 [ACK] Seq=1 Ack=1 Win=64256 Len=0 TSval=1337375165 TSecr=537649789"
"102","5.616365232","192.168.1.43","172.217.19.238","TLSv1.3","728","Client Hello (SNI=play.google.com)"
"103","5.618668958","192.168.1.43","172.217.19.238","TLSv1.3","72","Change Cipher Spec"
"104","5.623282094","192.168.1.43","172.217.19.238","TLSv1.3","236","Application Data"
"105","5.677820965","172.217.19.238","192.168.1.43","TCP","66","443  >  54108 [ACK] Seq=1 Ack=663 Win=65024 Len=0 TSval=537649904 TSecr=1337375223"
"106","5.680447224","172.217.19.238","192.168.1.43","TCP","66","443  >  54108 [ACK] Seq=1 Ack=669 Win=65280 Len=0 TSval=537649906 TSecr=1337375225"
"107","5.680447979","172.217.19.238","192.168.1.43","TCP","66","443  >  54108 [ACK] Seq=1 Ack=839 Win=65280 Len=0 TSval=537649910 TSecr=1337375230"
"108","5.804272781","172.217.19.238","192.168.1.43","TLSv1.3","834","Server Hello, Change Cipher Spec, Application Data, Application Data"
"109","5.804295922","192.168.1.43","172.217.19.238","TCP","66","54108  >  443 [ACK] Seq=839 Ack=769 Win=64128 Len=0 TSval=1337375411 TSecr=537650021"
"110","5.805722187","192.168.1.43","172.217.19.238","TLSv1.3","150","Application Data, Application Data"
"111","5.812059160","172.217.19.238","192.168.1.43","TLSv1.3","128","Application Data"
"112","5.812076734","192.168.1.43","172.217.19.238","TCP","66","54108  >  443 [ACK] Seq=923 Ack=831 Win=64128 Len=0 TSval=1337375418 TSecr=537650021"
"113","5.812059599","172.217.19.238","192.168.1.43","TLSv1.3","97","Application Data"
"114","5.812323587","192.168.1.43","172.217.19.238","TCP","66","54108  >  443 [ACK] Seq=923 Ack=862 Win=64128 Len=0 TSval=1337375419 TSecr=537650021"
"115","5.813364430","192.168.1.43","172.217.19.238","TLSv1.3","2157","Application Data"
"116","5.814015330","192.168.1.43","172.217.19.238","TLSv1.3","369","Application Data"
"117","5.821719071","192.168.1.43","172.217.19.238","TLSv1.3","97","Application Data"
"118","5.875001050","172.217.19.238","192.168.1.43","TCP","66","443  >  54108 [ACK] Seq=862 Ack=923 Win=65536 Len=0 TSval=537650092 TSecr=1337375412"
"119","5.886549404","172.217.19.238","192.168.1.43","TCP","66","443  >  54108 [ACK] Seq=862 Ack=2323 Win=68352 Len=0 TSval=537650100 TSecr=1337375420"
"120","5.886549848","172.217.19.238","192.168.1.43","TCP","66","443  >  54108 [ACK] Seq=862 Ack=3014 Win=71168 Len=0 TSval=537650100 TSecr=1337375420"
"121","5.886549898","172.217.19.238","192.168.1.43","TCP","66","443  >  54108 [ACK] Seq=862 Ack=3317 Win=73984 Len=0 TSval=537650101 TSecr=1337375420"
"122","5.893337485","172.217.19.238","192.168.1.43","TCP","66","443  >  54108 [ACK] Seq=862 Ack=3348 Win=73984 Len=0 TSval=537650108 TSecr=1337375428"
"123","6.030649009","172.217.19.238","192.168.1.43","TLSv1.3","831","Application Data"
"124","6.030701208","192.168.1.43","172.217.19.238","TCP","66","54108  >  443 [ACK] Seq=3348 Ack=1627 Win=64128 Len=0 TSval=1337375637 TSecr=537650238"
"125","6.030650127","172.217.19.238","192.168.1.43","TLSv1.3","286","Application Data"
"126","6.031927354","192.168.1.43","172.217.19.238","TCP","66","54108  >  443 [ACK] Seq=3348 Ack=1847 Win=64000 Len=0 TSval=1337375638 TSecr=537650238"
"127","6.030650490","172.217.19.238","192.168.1.43","TLSv1.3","332","Application Data"
"128","6.032514764","192.168.1.43","172.217.19.238","TCP","66","54108  >  443 [ACK] Seq=3348 Ack=2113 Win=63744 Len=0 TSval=1337375639 TSecr=537650241"
"129","6.030650732","172.217.19.238","192.168.1.43","TLSv1.3","105","Application Data"
"130","6.034960425","192.168.1.43","172.217.19.238","TCP","66","54108  >  443 [ACK] Seq=3348 Ack=2152 Win=63744 Len=0 TSval=1337375641 TSecr=537650242"
"131","6.037156427","192.168.1.43","172.217.19.238","TLSv1.3","105","Application Data"
"132","6.098899627","172.217.19.238","192.168.1.43","TCP","66","443  >  54108 [ACK] Seq=2152 Ack=3387 Win=73984 Len=0 TSval=537650326 TSecr=1337375644"
"133","7.180747956","142.250.181.74","192.168.1.43","TLSv1.2","151","Application Data"
"134","7.230510086","192.168.1.43","142.250.181.74","TCP","66","40540  >  443 [ACK] Seq=999 Ack=496 Win=501 Len=0 TSval=1803006934 TSecr=2027603135"
"135","8.149841966","192.168.1.43","34.107.243.93","TLSv1.2","96","Application Data"
"136","8.229253007","34.107.243.93","192.168.1.43","TCP","66","443  >  59406 [ACK] Seq=1 Ack=31 Win=283 Len=0 TSval=520067569 TSecr=3576296728"
"137","8.461250996","34.107.243.93","192.168.1.43","TLSv1.2","92","Application Data"
"138","8.502867288","192.168.1.43","34.107.243.93","TCP","66","59406  >  443 [ACK] Seq=31 Ack=27 Win=501 Len=0 TSval=3576297081 TSecr=520067799"
"139","8.703611374","192.168.1.43","35.213.12.39","TCP","66","55322  >  443 [ACK] Seq=1 Ack=1 Win=501 Len=0 TSval=3971022197 TSecr=3421927163"
"140","8.703842389","192.168.1.43","69.173.158.64","TCP","66","46726  >  443 [ACK] Seq=1 Ack=1 Win=501 Len=0 TSval=3439949507 TSecr=519766517"
"141","8.832102675","69.173.158.64","192.168.1.43","TCP","66","[TCP ACKed unseen segment] 443  >  46726 [ACK] Seq=1 Ack=2 Win=51183 Len=0 TSval=519769138 TSecr=3439928765"
"142","9.019312093","35.213.12.39","192.168.1.43","TCP","66","[TCP ACKed unseen segment] 443  >  55322 [ACK] Seq=1 Ack=2 Win=501 Len=0 TSval=3421937647 TSecr=3971001637"
"143","9.612066179","192.168.1.28","192.168.1.43","AMQP","91","Basic.Publish x= rk=my_queue "
"144","9.614110919","192.168.1.28","192.168.1.43","AMQP","88","Content-Header "
"145","9.614111415","192.168.1.28","192.168.1.43","AMQP","171","Content-Body "
"146","9.615526451","192.168.1.43","192.168.1.28","TCP","66","5672  >  35280 [ACK] Seq=592 Ack=674 Win=64768 Len=0 TSval=1852363500 TSecr=3545333587"
"147","9.746372831","PCSSystemtec_f1:a3:03","PCSSystemtec_34:b3:d3","ARP","42","Who has 192.168.1.28? Tell 192.168.1.43"
"148","9.757010860","PCSSystemtec_34:b3:d3","PCSSystemtec_f1:a3:03","ARP","60","192.168.1.28 is at 08:00:27:34:b3:d3"
"149","10.238931174","192.168.1.43","69.173.158.64","TCP","66","[TCP Dup ACK 1#1] 46710  >  443 [ACK] Seq=1 Ack=1 Win=501 Len=0 TSval=3439951042 TSecr=527114715"
"150","10.276098583","192.168.1.43","142.250.181.99","TLSv1.2","159","Application Data"
"151","10.331345507","142.250.181.99","192.168.1.43","TCP","66","443  >  53452 [ACK] Seq=1 Ack=94 Win=256 Len=0 TSval=2470795241 TSecr=2760250436"
"152","10.371543716","69.173.158.64","192.168.1.43","TCP","66","[TCP Dup ACK 2#1] 443  >  46710 [ACK] Seq=1 Ack=2 Win=51183 Len=0 TSval=527117274 TSecr=3439929646"
"153","10.460122838","142.250.181.99","192.168.1.43","TLSv1.2","175","Application Data"
"154","10.460147353","192.168.1.43","142.250.181.99","TCP","66","53452  >  443 [ACK] Seq=94 Ack=110 Win=330 Len=0 TSval=2760250620 TSecr=2470795363"
"155","10.460123272","142.250.181.99","192.168.1.43","TLSv1.2","140","Application Data"
"156","10.460393273","192.168.1.43","142.250.181.99","TCP","66","53452  >  443 [ACK] Seq=94 Ack=184 Win=330 Len=0 TSval=2760250620 TSecr=2470795363"
"157","10.460123372","142.250.181.99","192.168.1.43","TLSv1.2","97","Application Data"
"158","10.460550158","192.168.1.43","142.250.181.99","TCP","66","53452  >  443 [ACK] Seq=94 Ack=215 Win=330 Len=0 TSval=2760250620 TSecr=2470795363"
"159","10.460123436","142.250.181.99","192.168.1.43","TLSv1.2","105","Application Data"
"160","10.460671054","192.168.1.43","142.250.181.99","TCP","66","53452  >  443 [ACK] Seq=94 Ack=254 Win=330 Len=0 TSval=2760250620 TSecr=2470795363"
"161","10.462061664","192.168.1.43","142.250.181.99","TLSv1.2","105","Application Data"
"162","10.521850650","142.250.181.99","192.168.1.43","TCP","66","443  >  53452 [ACK] Seq=254 Ack=133 Win=256 Len=0 TSval=2470795430 TSecr=2760250621"
"163","10.599465990","34.107.243.93","192.168.1.43","TLSv1.2","90","Application Data"
"164","10.599495085","192.168.1.43","34.107.243.93","TCP","66","59406  >  443 [ACK] Seq=31 Ack=51 Win=501 Len=0 TSval=3576299178 TSecr=520069947"
"165","10.599976705","192.168.1.43","34.107.243.93","TLSv1.2","94","Application Data"
"166","10.671640148","34.107.243.93","192.168.1.43","TCP","66","443  >  59406 [ACK] Seq=51 Ack=59 Win=283 Len=0 TSval=520070017 TSecr=3576299178"
"167","10.764361104","192.168.1.43","51.79.154.29","TLSv1.2","144","Application Data"
"168","10.765162501","192.168.1.43","51.79.154.29","TLSv1.2","1644","Application Data"
"169","10.766198672","192.168.1.43","51.79.154.29","TLSv1.2","1686","Application Data"
"170","10.884959000","51.79.154.29","192.168.1.43","TCP","66","443  >  42138 [ACK] Seq=1 Ack=79 Win=851 Len=0 TSval=1079866679 TSecr=281647643"
"171","10.897425286","51.79.154.29","192.168.1.43","TCP","78","[TCP Window Update] 443  >  42138 [ACK] Seq=1 Ack=79 Win=857 Len=0 TSval=1079866692 TSecr=281647643 SLE=1519 SRE=1657"
"172","10.901287034","51.79.154.29","192.168.1.43","TCP","66","443  >  42138 [ACK] Seq=1 Ack=1657 Win=862 Len=0 TSval=1079866693 TSecr=281647644"
"173","10.901288129","51.79.154.29","192.168.1.43","TLSv1.2","114","Application Data"
"174","10.901358178","192.168.1.43","51.79.154.29","TCP","66","42138  >  443 [ACK] Seq=3277 Ack=49 Win=501 Len=0 TSval=281647780 TSecr=1079866693"
"175","10.901288217","51.79.154.29","192.168.1.43","TCP","78","[TCP Window Update] 443  >  42138 [ACK] Seq=49 Ack=1657 Win=868 Len=0 TSval=1079866693 TSecr=281647644 SLE=3097 SRE=3277"
"176","10.901288287","51.79.154.29","192.168.1.43","TCP","66","443  >  42138 [ACK] Seq=49 Ack=3277 Win=874 Len=0 TSval=1079866693 TSecr=281647645"
"177","10.901288675","51.79.154.29","192.168.1.43","TLSv1.2","114","Application Data"
"178","10.901853119","192.168.1.43","51.79.154.29","TCP","66","42138  >  443 [ACK] Seq=3277 Ack=97 Win=501 Len=0 TSval=281647780 TSecr=1079866693"
"179","10.901288830","51.79.154.29","192.168.1.43","TLSv1.2","645","Application Data"
"180","10.902740927","192.168.1.43","51.79.154.29","TCP","66","42138  >  443 [ACK] Seq=3277 Ack=676 Win=498 Len=0 TSval=281647781 TSecr=1079866696"
"181","10.912400066","192.168.1.43","3.0.107.214","TLSv1.2","237","Application Data"
"182","10.926637901","192.168.1.43","3.0.107.214","TLSv1.2","1573","Application Data"
"183","10.927753073","192.168.1.43","185.184.8.90","TLSv1.2","146","Application Data"
"184","10.929101962","192.168.1.43","185.184.8.90","TLSv1.2","1686","Application Data"
"185","10.931961630","192.168.1.43","185.184.10.30","TLSv1.2","146","Application Data"
"186","10.932703232","192.168.1.43","185.184.10.30","TLSv1.2","1686","Application Data"
"187","10.935963048","192.168.1.43","207.65.33.78","TLSv1.2","155","Application Data"
"188","10.936546473","192.168.1.43","207.65.33.78","TLSv1.2","1676","Application Data"
"189","10.937673993","192.168.1.43","52.210.204.184","TLSv1.2","156","Application Data"
"190","10.938218426","192.168.1.43","52.210.204.184","TLSv1.2","1685","Application Data"
"191","10.940034644","192.168.1.43","185.184.10.30","TLSv1.2","479","Application Data"
"192","10.945949885","192.168.1.43","3.0.107.214","TLSv1.2","1595","Application Data"
"193","10.948978216","192.168.1.43","185.184.8.90","TLSv1.2","359","Application Data"
"194","10.952074685","192.168.1.43","207.65.33.78","TLSv1.2","1310","Application Data"
"195","10.952402689","192.168.1.43","52.210.204.184","TLSv1.2","600","Application Data"
"196","10.952830301","192.168.1.43","104.18.36.155","UDP","1399","34013  >  443 Len=1357"
"197","10.953125700","192.168.1.43","104.18.36.155","UDP","1399","34013  >  443 Len=1357"
"198","10.953405132","192.168.1.43","104.18.36.155","UDP","200","34013  >  443 Len=158"
"199","10.978516787","192.168.1.43","182.161.73.145","TCP","74","56232  >  443 [SYN] Seq=0 Win=64240 Len=0 MSS=1460 SACK_PERM TSval=4221082465 TSecr=0 WS=128"
"200","11.001403877","192.168.1.43","69.173.158.65","TCP","74","49362  >  443 [SYN] Seq=0 Win=64240 Len=0 MSS=1460 SACK_PERM TSval=2627018765 TSecr=0 WS=128"
"201","11.001784451","192.168.1.43","192.168.1.1","DNS","87","Standard query 0xeefb A fastlane.rubiconproject.com"
"202","11.003774506","192.168.1.43","3.160.77.129","TLSv1.2","105","Application Data"
"203","11.005213491","192.168.1.1","192.168.1.43","DNS","103","Standard query response 0xeefb A fastlane.rubiconproject.com A 69.173.158.65"
"204","11.022514505","192.168.1.43","131.153.206.102","TLSv1.2","204","Application Data"
"205","11.023178445","192.168.1.43","131.153.206.102","TLSv1.2","1460","Application Data"
"206","11.023710210","192.168.1.43","131.153.206.102","TLSv1.2","1761","Application Data"
"207","11.043379499","192.168.1.43","131.153.206.102","TLSv1.2","204","Application Data"
"208","11.043993620","192.168.1.43","131.153.206.102","TLSv1.2","1460","Application Data"
"209","11.046862468","192.168.1.43","131.153.206.102","TLSv1.2","1657","Application Data"
"210","11.061986434","207.65.33.78","192.168.1.43","TCP","66","443  >  36862 [ACK] Seq=1 Ack=90 Win=32768 Len=0 TSval=2576165785 TSecr=4100423808"
"211","11.061986854","207.65.33.78","192.168.1.43","TCP","66","443  >  36862 [ACK] Seq=1 Ack=1700 Win=32768 Len=0 TSval=2576165786 TSecr=4100423809"
"212","11.061986935","3.0.107.214","192.168.1.43","TCP","66","443  >  53164 [ACK] Seq=1 Ack=1679 Win=27 Len=0 TSval=7367844 TSecr=156674277"
"213","11.066572270","3.0.107.214","192.168.1.43","TLSv1.2","114","Application Data"
"214","11.066593012","192.168.1.43","3.0.107.214","TCP","66","53164  >  443 [ACK] Seq=3208 Ack=49 Win=501 Len=0 TSval=156674431 TSecr=7367846"
"215","11.066572712","3.160.77.129","192.168.1.43","TCP","66","443  >  53416 [ACK] Seq=1 Ack=40 Win=135 Len=0 TSval=538146283 TSecr=3819803399"
"216","11.066572751","3.160.77.129","192.168.1.43","TLSv1.2","105","Application Data"
"217","11.066878963","192.168.1.43","3.160.77.129","TCP","66","53416  >  443 [ACK] Seq=40 Ack=40 Win=501 Len=0 TSval=3819803462 TSecr=538146283"
"218","11.084834460","3.0.107.214","192.168.1.43","TCP","66","443  >  53164 [ACK] Seq=49 Ack=3208 Win=27 Len=0 TSval=7367860 TSecr=156674310"
"219","11.084834929","3.0.107.214","192.168.1.43","TLSv1.2","114","Application Data"
"220","11.084863919","192.168.1.43","3.0.107.214","TCP","66","53164  >  443 [ACK] Seq=3208 Ack=97 Win=501 Len=0 TSval=156674449 TSecr=7367860"
"221","11.094899788","207.65.33.78","192.168.1.43","TCP","66","443  >  36862 [ACK] Seq=1 Ack=2944 Win=32768 Len=0 TSval=2576165812 TSecr=4100423824"
"222","11.102560387","207.65.33.78","192.168.1.43","TLSv1.2","150","Application Data"
"223","11.102586122","192.168.1.43","207.65.33.78","TCP","66","36862  >  443 [ACK] Seq=2944 Ack=85 Win=501 Len=0 TSval=4100423975 TSecr=2576165815"
"224","11.108971915","3.0.107.214","192.168.1.43","TLSv1.2","518","Application Data"
"225","11.109010609","192.168.1.43","3.0.107.214","TCP","66","53164  >  443 [ACK] Seq=3208 Ack=549 Win=501 Len=0 TSval=156674473 TSecr=7367876"
"226","11.108972670","104.18.36.155","192.168.1.43","UDP","69","443  >  34013 Len=27"
"227","11.108972787","104.18.36.155","192.168.1.43","UDP","69","443  >  34013 Len=27"
"228","11.110536035","182.161.73.145","192.168.1.43","TCP","74","443  >  56232 [SYN, ACK] Seq=0 Ack=1 Win=65160 Len=0 MSS=1452 SACK_PERM TSval=340165790 TSecr=4221082465 WS=1024"
"229","11.110569651","192.168.1.43","182.161.73.145","TCP","66","56232  >  443 [ACK] Seq=1 Ack=1 Win=64256 Len=0 TSval=4221082597 TSecr=340165790"
"230","11.117811705","185.184.8.90","192.168.1.43","TCP","66","443  >  44688 [ACK] Seq=1 Ack=1701 Win=1385 Len=0 TSval=329578865 TSecr=2995719960"
"231","11.117812109","185.184.8.90","192.168.1.43","TLSv1.2","114","Application Data"
"232","11.117849126","192.168.1.43","185.184.8.90","TCP","66","44688  >  443 [ACK] Seq=1994 Ack=49 Win=501 Len=0 TSval=2995720150 TSecr=329578865"
"233","11.124393000","69.173.158.65","192.168.1.43","TCP","74","443  >  49362 [SYN, ACK] Seq=0 Ack=1 Win=14600 Len=0 MSS=1452 WS=4 SACK_PERM TSval=1146190488 TSecr=2627018765"
"234","11.124428264","192.168.1.43","69.173.158.65","TCP","66","49362  >  443 [ACK] Seq=1 Ack=1 Win=64256 Len=0 TSval=2627018888 TSecr=1146190488"
"235","11.129912219","192.168.1.43","182.161.73.145","TLSv1.3","751","Client Hello (SNI=bidder.criteo.com)"
"236","11.131137077","192.168.1.43","182.161.73.145","TLSv1.3","72","Change Cipher Spec"
"237","11.131767482","192.168.1.43","182.161.73.145","TLSv1.3","236","Application Data"
"238","11.136288712","52.210.204.184","192.168.1.43","TCP","66","443  >  42340 [ACK] Seq=1 Ack=91 Win=428 Len=0 TSval=3144341971 TSecr=3382331771"
"239","11.151213492","52.210.204.184","192.168.1.43","TCP","66","443  >  42340 [ACK] Seq=1 Ack=1531 Win=428 Len=0 TSval=3144341973 TSecr=3382331772"
"240","11.151213920","52.210.204.184","192.168.1.43","TCP","66","443  >  42340 [ACK] Seq=1 Ack=1710 Win=428 Len=0 TSval=3144341973 TSecr=3382331772"
"241","11.151213976","52.210.204.184","192.168.1.43","TLSv1.2","101","Application Data"
"242","11.151245913","192.168.1.43","52.210.204.184","TCP","66","42340  >  443 [ACK] Seq=2244 Ack=36 Win=501 Len=0 TSval=3382331985 TSecr=3144341973"
"243","11.151214047","185.184.8.90","192.168.1.43","TLSv1.2","114","Application Data"
"244","11.151439830","192.168.1.43","185.184.8.90","TCP","66","44688  >  443 [ACK] Seq=1994 Ack=97 Win=501 Len=0 TSval=2995720184 TSecr=329578892"
"245","11.151214089","185.184.8.90","192.168.1.43","TLSv1.2","271","Application Data"
"246","11.151597210","192.168.1.43","185.184.8.90","TCP","66","44688  >  443 [ACK] Seq=1994 Ack=302 Win=500 Len=0 TSval=2995720184 TSecr=329578894"
"247","11.151214165","131.153.206.102","192.168.1.43","TCP","66","443  >  36744 [ACK] Seq=1 Ack=1533 Win=70 Len=0 TSval=3953700976 TSecr=3171320059"
"248","11.151214238","131.153.206.102","192.168.1.43","TCP","66","443  >  36744 [ACK] Seq=1 Ack=3228 Win=70 Len=0 TSval=3953700977 TSecr=3171320060"
"249","11.159767155","131.153.206.102","192.168.1.43","TLSv1.2","242","Application Data"
"250","11.159829865","192.168.1.43","131.153.206.102","TCP","66","36744  >  443 [ACK] Seq=6351 Ack=177 Win=501 Len=0 TSval=3171320196 TSecr=3953700981"
"251","11.167915044","131.153.206.102","192.168.1.43","TCP","66","443  >  36744 [ACK] Seq=177 Ack=4760 Win=70 Len=0 TSval=3953700997 TSecr=3171320080"
"252","11.172698697","131.153.206.102","192.168.1.43","TCP","66","443  >  36744 [ACK] Seq=177 Ack=6351 Win=70 Len=0 TSval=3953701000 TSecr=3171320083"
"253","11.192264706","131.153.206.102","192.168.1.43","TLSv1.2","219","Application Data"
"254","11.192290800","192.168.1.43","131.153.206.102","TCP","66","36744  >  443 [ACK] Seq=6351 Ack=330 Win=501 Len=0 TSval=3171320229 TSecr=3953701011"
"255","11.192265596","52.210.204.184","192.168.1.43","TLSv1.2","764","Application Data"
"256","11.192546113","192.168.1.43","52.210.204.184","TCP","66","42340  >  443 [ACK] Seq=2244 Ack=734 Win=501 Len=0 TSval=3382332026 TSecr=3144342032"
"257","11.192265651","52.210.204.184","192.168.1.43","TLSv1.2","97","Application Data"
"258","11.192871139","192.168.1.43","52.210.204.184","TCP","66","42340  >  443 [ACK] Seq=2244 Ack=765 Win=501 Len=0 TSval=3382332026 TSecr=3144342032"
"259","11.199923406","192.168.1.43","69.173.158.65","TLSv1.3","757","Client Hello (SNI=fastlane.rubiconproject.com)"
"260","11.230495006","192.168.1.43","37.157.5.132","TLSv1.2","148","Application Data"
"261","11.231368950","192.168.1.43","37.157.5.132","TLSv1.2","1711","Application Data"
"262","11.232014189","192.168.1.43","103.43.90.117","TCP","74","41224  >  443 [SYN] Seq=0 Win=64240 Len=0 MSS=1460 SACK_PERM TSval=919325091 TSecr=0 WS=128"
"263","11.232191770","192.168.1.43","37.157.5.132","TLSv1.2","490","Application Data"
"264","11.271231692","185.184.10.30","192.168.1.43","TCP","66","443  >  53092 [ACK] Seq=1 Ack=1701 Win=1410 Len=0 TSval=2695467032 TSecr=113264014"
"265","11.271232121","185.184.10.30","192.168.1.43","TLSv1.2","114","Application Data"
"266","11.271266544","192.168.1.43","185.184.10.30","TCP","66","53092  >  443 [ACK] Seq=2114 Ack=49 Win=501 Len=0 TSval=113264354 TSecr=2695467032"
"267","11.271232214","185.184.10.30","192.168.1.43","TLSv1.2","114","Application Data"
"268","11.271445514","192.168.1.43","185.184.10.30","TCP","66","53092  >  443 [ACK] Seq=2114 Ack=97 Win=501 Len=0 TSval=113264354 TSecr=2695467037"
"269","11.271232323","185.184.10.30","192.168.1.43","TLSv1.2","271","Application Data"
"270","11.271575471","192.168.1.43","185.184.10.30","TCP","66","53092  >  443 [ACK] Seq=2114 Ack=302 Win=501 Len=0 TSval=113264354 TSecr=2695467039"
"271","11.271232389","182.161.73.145","192.168.1.43","TLSv1.3","308","Server Hello, Change Cipher Spec, Application Data, Application Data"
"272","11.271735309","192.168.1.43","182.161.73.145","TCP","66","56232  >  443 [ACK] Seq=862 Ack=243 Win=64128 Len=0 TSval=4221082758 TSecr=340165942"
"273","11.272976617","192.168.1.43","182.161.73.145","TLSv1.3","150","Application Data, Application Data"
"274","11.288367895","192.168.1.43","3.160.77.129","TLSv1.2","161","Application Data"
"275","11.289349488","104.18.36.155","192.168.1.43","UDP","680","443  >  34013 Len=638"
"276","11.290019186","192.168.1.43","3.160.77.129","TLSv1.2","101","Application Data"
"277","11.294818868","182.161.73.145","192.168.1.43","TCP","66","443  >  56232 [ACK] Seq=243 Ack=862 Win=64512 Len=0 TSval=340165985 TSecr=4221082618"
"278","11.298235271","192.168.1.43","182.161.73.145","TLSv1.3","394","Application Data"
"279","11.298626499","192.168.1.43","182.161.73.145","TLSv1.3","2527","Application Data"
"280","11.316095008","69.173.158.65","192.168.1.43","TLSv1.3","199","Server Hello, Change Cipher Spec"
"281","11.316120068","192.168.1.43","69.173.158.65","TCP","66","49362  >  443 [ACK] Seq=692 Ack=134 Win=64128 Len=0 TSval=2627019080 TSecr=1146190539"
"282","11.316095418","69.173.158.65","192.168.1.43","TLSv1.3","107","Application Data"
"283","11.316308328","192.168.1.43","69.173.158.65","TCP","66","49362  >  443 [ACK] Seq=692 Ack=175 Win=64128 Len=0 TSval=2627019080 TSecr=1146190539"
"284","11.318103928","69.173.158.65","192.168.1.43","TCP","1466","443  >  49362 [PSH, ACK] Seq=175 Ack=692 Win=25920 Len=1400 TSval=1146190539 TSecr=2627018963 [TCP segment of a reassembled PDU]"
"285","11.318127375","192.168.1.43","69.173.158.65","TCP","66","49362  >  443 [ACK] Seq=692 Ack=1575 Win=63488 Len=0 TSval=2627019082 TSecr=1146190539"
"286","11.318104260","69.173.158.65","192.168.1.43","TCP","1430","443  >  49362 [PSH, ACK] Seq=1575 Ack=692 Win=25920 Len=1364 TSval=1146190539 TSecr=2627018963 [TCP segment of a reassembled PDU]"
"287","11.318293698","192.168.1.43","69.173.158.65","TCP","66","49362  >  443 [ACK] Seq=692 Ack=2939 Win=62336 Len=0 TSval=2627019082 TSecr=1146190539"
"288","11.318104440","69.173.158.65","192.168.1.43","TLSv1.3","311","Application Data"
"289","11.318421774","192.168.1.43","69.173.158.65","TCP","66","49362  >  443 [ACK] Seq=692 Ack=3184 Win=62208 Len=0 TSval=2627019082 TSecr=1146190539"
"290","11.318104501","69.173.158.65","192.168.1.43","TLSv1.3","352","Application Data"
"291","11.318104566","69.173.158.65","192.168.1.43","TLSv1.3","140","Application Data"
"292","11.318620706","192.168.1.43","69.173.158.65","TCP","66","49362  >  443 [ACK] Seq=692 Ack=3470 Win=61952 Len=0 TSval=2627019082 TSecr=1146190539"
"293","11.319259604","192.168.1.43","69.173.158.65","TCP","66","49362  >  443 [ACK] Seq=692 Ack=3544 Win=61952 Len=0 TSval=2627019083 TSecr=1146190539"
"294","11.331729086","192.168.1.43","3.160.73.152","TLSv1.2","206","Application Data"
"295","11.332518870","192.168.1.43","3.160.73.152","TLSv1.2","101","Application Data"
"296","11.333839381","192.168.1.43","69.173.158.65","TLSv1.3","146","Change Cipher Spec, Application Data"
"297","11.335212074","192.168.1.43","69.173.158.65","TLSv1.3","236","Application Data"
"298","11.335508057","192.168.1.43","69.173.158.65","TLSv1.3","1714","Application Data"
"299","11.347365929","192.168.1.43","104.18.36.155","UDP","88","34013  >  443 Len=46"
"300","11.353220286","3.160.77.129","192.168.1.43","TLSv1.2","916","Application Data"
"301","11.353351687","192.168.1.43","3.160.77.129","TCP","66","53416  >  443 [ACK] Seq=170 Ack=890 Win=501 Len=0 TSval=3819803749 TSecr=538146568"
"302","11.364447134","103.43.90.117","192.168.1.43","TCP","74","443  >  41224 [SYN, ACK] Seq=0 Ack=1 Win=43440 Len=0 MSS=1452 SACK_PERM TSval=2291059640 TSecr=919325091 WS=512"
"303","11.364618134","192.168.1.43","103.43.90.117","TCP","66","41224  >  443 [ACK] Seq=1 Ack=1 Win=64256 Len=0 TSval=919325224 TSecr=2291059640"
"304","11.369439732","192.168.1.43","103.43.90.117","TLSv1.2","651","Client Hello (SNI=ib.adnxs.com)"
"305","11.395344378","3.160.73.152","192.168.1.43","TCP","66","443  >  43136 [ACK] Seq=1 Ack=141 Win=233 Len=0 TSval=1621481064 TSecr=3775753368"
"306","11.395344882","3.160.73.152","192.168.1.43","TCP","2922","443  >  43136 [PSH, ACK] Seq=1 Ack=141 Win=233 Len=2856 TSval=1621481065 TSecr=3775753368 [TCP segment of a reassembled PDU]"
"307","11.395474056","192.168.1.43","3.160.73.152","TCP","66","43136  >  443 [ACK] Seq=176 Ack=2857 Win=2268 Len=0 TSval=3775753432 TSecr=1621481065"
"308","11.395344934","3.160.73.152","192.168.1.43","TLSv1.2","1151","Application Data"
"309","11.395644120","192.168.1.43","3.160.73.152","TCP","66","43136  >  443 [ACK] Seq=176 Ack=3942 Win=2260 Len=0 TSval=3775753432 TSecr=1621481066"
"310","11.406520501","3.160.77.129","192.168.1.43","TCP","66","443  >  53416 [ACK] Seq=890 Ack=170 Win=135 Len=0 TSval=538146620 TSecr=3819803685"
"311","11.406520735","182.161.73.145","192.168.1.43","TCP","66","443  >  56232 [ACK] Seq=243 Ack=946 Win=64512 Len=0 TSval=340166087 TSecr=4221082759"
"312","11.406520787","182.161.73.145","192.168.1.43","TLSv1.3","130","Application Data"
"313","11.406569026","192.168.1.43","182.161.73.145","TCP","66","56232  >  443 [ACK] Seq=3735 Ack=307 Win=64128 Len=0 TSval=4221082893 TSecr=340166087"
"314","11.408630300","192.168.1.43","182.161.73.145","TLSv1.3","97","Application Data"
"315","11.440738391","3.160.73.152","192.168.1.43","TCP","66","443  >  43136 [ACK] Seq=3942 Ack=176 Win=233 Len=0 TSval=1621481111 TSecr=3775753369"
"316","11.440738858","37.157.5.132","192.168.1.43","TCP","66","443  >  39792 [ACK] Seq=1 Ack=83 Win=345 Len=0 TSval=412903 TSecr=1670030602"
"317","11.440739033","37.157.5.132","192.168.1.43","TLSv1.2","108","Application Data"
"318","11.440786196","192.168.1.43","37.157.5.132","TCP","66","39792  >  443 [ACK] Seq=2152 Ack=43 Win=501 Len=0 TSval=1670030812 TSecr=412903"
"319","11.440739141","37.157.5.132","192.168.1.43","TCP","66","443  >  39792 [ACK] Seq=43 Ack=1728 Win=352 Len=0 TSval=412904 TSecr=1670030603"
"320","11.454125329","69.173.158.65","192.168.1.43","TLSv1.3","353","Application Data"
"321","11.454284975","192.168.1.43","69.173.158.65","TCP","66","49362  >  443 [ACK] Seq=2590 Ack=3831 Win=64128 Len=0 TSval=2627019218 TSecr=1146190571"
"322","11.454125761","69.173.158.65","192.168.1.43","TLSv1.3","353","Application Data"
"323","11.454125869","69.173.158.65","192.168.1.43","TLSv1.3","109","Application Data"
"324","11.454125996","69.173.158.65","192.168.1.43","TCP","84","443  >  49362 [PSH, ACK] Seq=4161 Ack=2590 Win=66240 Len=18 TSval=1146190571 TSecr=2627019099 [TCP segment of a reassembled PDU]"
"325","11.454126106","69.173.158.65","192.168.1.43","TLSv1.3","92","Application Data"
"326","11.454126169","69.173.158.65","192.168.1.43","TCP","66","443  >  49362 [ACK] Seq=4161 Ack=2590 Win=63360 Len=0 TSval=1146190571 TSecr=2627019099"
"327","11.456114293","192.168.1.43","69.173.158.65","TCP","66","49362  >  443 [ACK] Seq=2590 Ack=4118 Win=63872 Len=0 TSval=2627019220 TSecr=1146190571"
"328","11.456662359","192.168.1.43","69.173.158.65","TCP","66","49362  >  443 [ACK] Seq=2590 Ack=4161 Win=63872 Len=0 TSval=2627019220 TSecr=1146190571"
"329","11.456829672","192.168.1.43","69.173.158.65","TCP","66","49362  >  443 [ACK] Seq=2590 Ack=4179 Win=63872 Len=0 TSval=2627019220 TSecr=1146190571"
"330","11.457303084","192.168.1.43","69.173.158.65","TCP","66","49362  >  443 [ACK] Seq=2590 Ack=4205 Win=63872 Len=0 TSval=2627019221 TSecr=1146190571"
"331","11.457463147","192.168.1.43","69.173.158.65","TCP","66","[TCP Dup ACK 330#1] 49362  >  443 [ACK] Seq=2590 Ack=4205 Win=63872 Len=0 TSval=2627019221 TSecr=1146190571"
"332","11.458084340","192.168.1.43","69.173.158.65","TLSv1.3","97","Application Data"
"333","11.458753320","69.173.158.65","192.168.1.43","TLSv1.3","599","Application Data"
"334","11.458753704","69.173.158.65","192.168.1.43","TLSv1.3","586","Application Data"
